{
  "id": "king-4-throne",
  "name": "Crystal Throne",
  "world": "lumenari",
  "difficulty": "normal",
  "mode": "king",
  "slots": 4,
  "cols": 13,
  "rows": 19,
  "legend": {
    ".": "scenery",
    "#": "path",
    "o": "pad",
    "S": "spawn",
    "E": "exit"
  },
  "grid": [
    ".Eo...S...oE.",
    ".#....#....#.",
    "##...o#o...##",
    "#.o...#...o.#",
    "#o....#....o#",
    "###o.o#o.o###",
    "..#...#...#..",
    ".o#o..#..o#o.",
    "..#.oo#oo.#..",
    "..#########..",
    "..#.o.o.o.#..",
    ".o#o.....o#o.",
    "..#.......#..",
    "###o.....o###",
    "#o.........o#",
    "#.o.......o.#",
    "##.........##",
    ".#.........#.",
    ".Eo.......oE."
  ],
  "zones": [
    "00000...33333",
    "00000...33333",
    "00000...33333",
    "00000...33333",
    "00000...33333",
    "00000...33333",
    "00000...33333",
    "00000...33333",
    "0000.....3333",
    ".............",
    "1111.....2222",
    "11111...22222",
    "11111...22222",
    "11111...22222",
    "11111...22222",
    "11111...22222",
    "11111...22222",
    "11111...22222",
    "11111...22222"
  ],
  "background": "/maps/king-4-throne.jpg",
  "content_version": "0.11.0"
}
