{
  "id": "king-2-foundry",
  "name": "Foundry Crown",
  "world": "assembly",
  "difficulty": "normal",
  "mode": "king",
  "slots": 2,
  "cols": 13,
  "rows": 16,
  "legend": {
    ".": "scenery",
    "#": "path",
    "o": "pad",
    "S": "spawn",
    "E": "exit"
  },
  "grid": [
    ".E.........E.",
    "o#o.......o#o",
    ".#.........#.",
    "o#.o.....o.#o",
    ".####o.o####.",
    "..oo#...#oo..",
    "....#ooo#....",
    "....#####....",
    ".....o#o.....",
    "..#####......",
    ".o#o.o.o.....",
    "..#########..",
    "....o.o..o#o.",
    "........o.#..",
    ".....o#####..",
    "......So....."
  ],
  "zones": [
    "000000.111111",
    "000000.111111",
    "000000.111111",
    "000000.111111",
    "000000.111111",
    "000000.111111",
    "000000.111111",
    "000000.111111",
    ".............",
    ".............",
    ".............",
    ".............",
    ".............",
    ".............",
    ".............",
    "............."
  ],
  "background": "/maps/king-2-foundry.jpg",
  "content_version": "0.10.0"
}
