{
  "id": "lanes-2-hollows",
  "name": "Twin Hollows",
  "world": "rootkin",
  "difficulty": "normal",
  "mode": "lanes",
  "slots": 2,
  "cols": 12,
  "rows": 16,
  "legend": {
    ".": "scenery",
    "#": "path",
    "o": "pad",
    "S": "spawn",
    "E": "exit"
  },
  "grid": [
    "...o....o...",
    "S##########.",
    "..o..o..o.#.",
    ".##########.",
    ".#.o..o..o..",
    ".##########E",
    "...o....o...",
    "............",
    "...o....o...",
    "S##########.",
    "..o..o..o.#.",
    ".##########.",
    ".#.o..o..o..",
    ".##########E",
    "...o....o...",
    "............"
  ],
  "zones": [
    "...0....0...",
    "00000000000.",
    "..0..0..0.0.",
    ".0000000000.",
    ".0.0..0..0..",
    ".00000000000",
    "...0....0...",
    "............",
    "...1....1...",
    "11111111111.",
    "..1..1..1.1.",
    ".1111111111.",
    ".1.1..1..1..",
    ".11111111111",
    "...1....1...",
    "............"
  ],
  "background": "/maps/lanes-2-hollows.jpg",
  "content_version": "0.10.0"
}
