{
  "id": "lanes-3-prism",
  "name": "Three Rivers of Light",
  "world": "lumenari",
  "difficulty": "normal",
  "mode": "lanes",
  "slots": 3,
  "cols": 12,
  "rows": 18,
  "legend": {
    ".": "scenery",
    "#": "path",
    "o": "pad",
    "S": "spawn",
    "E": "exit"
  },
  "grid": [
    "..o...o..o..",
    "S##########.",
    ".o..o..o..#.",
    "E##########.",
    "...o..o..o..",
    "............",
    "..o...o..o..",
    "S##########.",
    ".o..o..o..#.",
    "E##########.",
    "...o..o..o..",
    "............",
    "..o...o..o..",
    "S##########.",
    ".o..o..o..#.",
    "E##########.",
    "...o..o..o..",
    "............"
  ],
  "zones": [
    "..0...0..0..",
    "00000000000.",
    ".0..0..0..0.",
    "00000000000.",
    "...0..0..0..",
    "............",
    "..1...1..1..",
    "11111111111.",
    ".1..1..1..1.",
    "11111111111.",
    "...1..1..1..",
    "............",
    "..2...2..2..",
    "22222222222.",
    ".2..2..2..2.",
    "22222222222.",
    "...2..2..2..",
    "............"
  ],
  "background": "/maps/lanes-3-prism.jpg",
  "content_version": "0.10.0"
}
