{
  "id": "king-3-elderfork",
  "name": "Elder Fork",
  "world": "rootkin",
  "difficulty": "normal",
  "mode": "king",
  "slots": 3,
  "cols": 13,
  "rows": 18,
  "legend": {
    ".": "scenery",
    "#": "path",
    "o": "pad",
    "S": "spawn",
    "E": "exit"
  },
  "grid": [
    "....o.S......",
    "..#####o.....",
    "..#o.o..o....",
    "..#########..",
    ".o...o.o.o#o.",
    "......#####..",
    "......#......",
    "......#......",
    ".o#########o.",
    "..#o..#..o#..",
    "o.#...#...#.o",
    "E##o.o#..o##E",
    "oo.o..#o.o.oo",
    ".....o#......",
    "......#o.....",
    ".....o#......",
    "......#o.....",
    ".....oE......"
  ],
  "zones": [
    ".............",
    ".............",
    ".............",
    ".............",
    ".............",
    ".............",
    ".............",
    ".............",
    "000000.222222",
    "0000011122222",
    "0000011122222",
    "0000011122222",
    "0000011122222",
    "0000011122222",
    "0000011122222",
    "0000011122222",
    "0000011122222",
    "0000011122222"
  ],
  "background": "/maps/king-3-elderfork.jpg",
  "content_version": "0.11.0"
}
