{
  "id": "lumenari-crystal-01",
  "name": "Prism Span",
  "world": "lumenari",
  "difficulty": "hard",
  "cols": 12,
  "rows": 16,
  "legend": {
    ".": "scenery",
    "#": "path",
    "o": "pad",
    "S": "spawn",
    "E": "exit"
  },
  "grid": [
    "S...........",
    "######......",
    ".o...#.o....",
    ".....#......",
    "..o..#######",
    "...........#",
    "..o.o.o....#",
    "...........#",
    "..##########",
    "..#..o......",
    "..#....o..o.",
    "..####......",
    ".o...#.o....",
    ".....######.",
    "..o.o.....#.",
    "..........E."
  ],
  "background": "/maps/lumenari-crystal-01.png",
  "content_version": "0.2.0"
}
