{
  "id": "lanes-4-warrens",
  "name": "Four Warrens",
  "world": "chitin",
  "difficulty": "normal",
  "mode": "lanes",
  "slots": 4,
  "cols": 12,
  "rows": 20,
  "legend": {
    ".": "scenery",
    "#": "path",
    "o": "pad",
    "S": "spawn",
    "E": "exit"
  },
  "grid": [
    "..o...o..o..",
    "S##########.",
    "..o..o..o.#.",
    "E##########.",
    "....o...o...",
    "..o...o..o..",
    "S##########.",
    "..o..o..o.#.",
    "E##########.",
    "....o...o...",
    "..o...o..o..",
    "S##########.",
    "..o..o..o.#.",
    "E##########.",
    "....o...o...",
    "..o...o..o..",
    "S##########.",
    "..o..o..o.#.",
    "E##########.",
    "....o...o..."
  ],
  "zones": [
    "..0...0..0..",
    "00000000000.",
    "..0..0..0.0.",
    "00000000000.",
    "....0...0...",
    "..1...1..1..",
    "11111111111.",
    "..1..1..1.1.",
    "11111111111.",
    "....1...1...",
    "..2...2..2..",
    "22222222222.",
    "..2..2..2.2.",
    "22222222222.",
    "....2...2...",
    "..3...3..3..",
    "33333333333.",
    "..3..3..3.3.",
    "33333333333.",
    "....3...3..."
  ],
  "background": "/maps/lanes-4-warrens.jpg",
  "content_version": "0.11.0"
}
